{
  "schemaVersion": 1,
  "announcement": "",
  "texts": {
    "homeTitle": "CC保镖",
    "connecting": "连接中...",
    "harmonyAccount": "账号",
    "harmonyRouteLabel": "线路",
    "harmonyAiRoutingLabel": "AI",
    "network": "网络",
    "harmonyHealthLabel": "连接检查",
    "harmonyCredentialsError": "用户名或密码错误。",
    "harmonySessionExpired": "登录已过期，请重新登录。",
    "harmonyRateLimited": "尝试次数过多，请一分钟后重试。",
    "harmonyServiceError": "暂时无法连接服务，请检查网络后重试。",
    "harmonyConfigError": "暂时无法获取可用线路，请稍后点击连接重试。",
    "simpleConnectFailed": "启动失败，请检查 VPN 授权后重试。",
    "harmonyConfigCheckReasonOffline": "网络不可用",
    "harmonyConfigCheckReasonRateLimit": "请求过于频繁",
    "harmonyAiRoutingHint": "链路加速",
    "harmonyConfigCheckReasonServer": "服务器暂时不可用",
    "harmonyConfigFreshAutoUpdated": "配置已自动更新",
    "harmonyConfigFreshCheckFailed": "无法检查更新，正在使用缓存配置（{reason}）",
    "harmonyConfigFreshUpToDate": "配置已是最新（版本 {version}，{time} 检查）",
    "harmonyConfigFreshUpdating": "发现新配置，正在更新…",
    "harmonyConfigFreshUnknown": "尚未完成配置检查",
    "harmonyConfigPreparing": "正在准备连接配置…",
    "harmonyConfigRefreshTooltip": "刷新配置",
    "harmonyConfigSyncedAt": "配置已同步（{time}）",
    "harmonyConnecting": "正在连接…",
    "harmonyCurrentNode": "当前节点",
    "harmonyDisconnecting": "正在断开…",
    "harmonyDownload": "下载",
    "harmonyHealthCheckFailed": "未通过 · {time}",
    "harmonyHealthCheckOk": "正常 · {time}",
    "harmonyIssueActionAuthExpired": "下一步：点「退出登录」后重新登录",
    "harmonyIssueActionNoRoute": "下一步：稍后点上方图标重试连接",
    "harmonyIssueActionOfflineCached": "下一步：点上方图标连接",
    "harmonyIssueActionRateLimit": "下一步：稍后再试",
    "harmonyIssueActionService": "下一步：检查网络后点上方图标连接",
    "harmonyIssueActionSubscription": "下一步：点上方图标连接或稍后再试",
    "harmonyIssueActionVpnFailed": "下一步：点上方图标连接并允许 VPN",
    "harmonyIssueDetailAuthExpired": "你的登录状态已过期，需要重新登录才能更新订阅。",
    "harmonyIssueDetailNoRoute": "当前保存的线路都连不通。请稍后点上方图标重试连接，或等服务恢复后自动更新。",
    "harmonyIssueDetailOfflineCached": "账号服务器暂时连不上，正在使用上次保存的线路。可先点上方图标连接；网络恢复后会自动更新配置。",
    "harmonyIssueDetailRateLimit": "请等待约一分钟后再试登录或连接。",
    "harmonyIssueDetailService": "无法连接账号服务器。请检查网络；若已有缓存配置，仍可点上方图标尝试连接。",
    "harmonyIssueDetailSubscription": "登录已成功，但线路配置尚未准备好。请点上方图标重试。若有缓存配置，仍可尝试连接。",
    "harmonyIssueDetailVpnFailed": "系统 VPN 没有成功启动。请确认已允许 VPN 权限，然后点上方图标重新连接。",
    "harmonyIssueTitleAuthExpired": "登录已失效",
    "harmonyIssueTitleNoRoute": "没有可用线路",
    "harmonyIssueTitleOfflineCached": "暂时无法更新订阅",
    "harmonyIssueTitleRateLimit": "操作过于频繁",
    "harmonyIssueTitleService": "服务暂时不可用",
    "harmonyIssueTitleSubscription": "连接配置暂不可用",
    "harmonyIssueTitleVpnFailed": "VPN 未能启动",
    "harmonyLatency": "延迟",
    "harmonyLogin": "登录",
    "harmonyLoginHint": "守护 Claude 与 Codex，登录后自动获取线路。",
    "harmonyLogout": "退出登录",
    "harmonyNetworkCellular": "移动数据",
    "harmonyNetworkOther": "其他连接",
    "harmonyNetworkUnknown": "未识别",
    "harmonyNetworkWifi": "Wi-Fi",
    "harmonyRequired": "请填写此项。",
    "harmonyRetry": "重试",
    "harmonyRouteReasonAuto": "自动选择",
    "harmonyRouteReasonManual": "按测速结果选择",
    "harmonyRouteReasonTcp": "稳定连接优先",
    "harmonySessionTraffic": "本次流量",
    "harmonyStatusSection": "连接说明",
    "harmonySwitchNode": "切换节点",
    "harmonyUpload": "上传",
    "harmonyUsername": "用户名",
    "password": "密码",
    "simpleAutoRoute": "自动选择",
    "simpleConnect": "连接",
    "simpleDisconnect": "断开",
    "simpleErrorState": "连接异常",
    "simpleReady": "准备连接",
    "simpleRunning": "代理已启动",
    "harmonyConfigRefreshSuccess": "配置已更新",
    "harmonyConfigRefreshFailed": "配置刷新失败",
    "harmonyConfigRefreshDebounced": "请稍后再试",
    "harmonyLatencyValue": "{label}: {delay} ms",
    "harmonyAccountValue": "{label}: {username}",
    "harmonySpeedValue": "{value}/s"
  },
  "home": {
    "sections": [
      "announcement",
      "connection",
      "config",
      "issue",
      "insights",
      "traffic",
      "account"
    ],
    "details": [
      "route",
      "ai",
      "network",
      "health"
    ]
  }
}
